<?xml version="1.0" encoding="UTF-8"?>
<layout xmlns="http://magento.com/schema/theme/layout"
xmlns:xsi="http://www.w3.org/2001/XMLSchema-instance"
xsi:schemaLocation=" ../xsd/theme_layout_local.xsd">
    <default>
        <remove name="right.poll"></remove>
        
        <reference name="referencia">
            <action method="index">
                <applied></applied>
            </action>
        </reference>
        
        <block name="name" type="type" as="alias">
            <action method="method">
                <applied>1</applied>
                <stylesheet>stylesheets</stylesheet>
                <template></template>
            </action>
        </block>
    </default>
</layout>
